,instruction,input,output
234,How can you check if a list contains duplicate elements in Python ?,"list1 [1, 5, 3, 2, 4, 3, 10]","To check if a list contains duplicate elements in Python, you can use the ""len()"" and ""set()"" functions. By using the ""len()"" function to get the length of the list and the ""set()"" function to create a set from the list, you can compare the lengths of the list and set to determine if there are any duplicate elements. If the lengths are the same, then no elements are duplicated; if the set length is less than the list length, then it contains duplicates."
235,What does an empty dictionary represent in Python ?,,An empty dictionary in Python is an empty mapping that does not contain any elements. It is represented as an empty set of curly brackets and is used to store data in key-value pairs. An empty dictionary has no values associated with any keys and is often used as an initialization value.
236,How can you iterate in a nested loop ?,def nested loop iter list for a in list for b in list if iter a b,"iterate through the elements in the list by nesting two for loops, the first for loop for each element in the list, and the second for loop iterating through each item in the element."
237,How can you perform a cross join of two datasets ?,"ds_1 = [1, 2, 3]
ds_2 = [""A"", ""B"", ""C""]","Use a nested for loop to perform a cross join of two datasets. For each element in the first dataset, each element in the second dataset will be appended to the existing list. The resulting list will contain the cross join of two datasets."
238,Where can you find the longest common subsequence ?,"list_1 = [3, 1, 4, 5, 9] 
list_2 = [5, 3, 8, 9, 7]","Use a dynamic programming approach to find the longest common subsequence. First, you need to build a matrix of the two lists to track the position of the shared elements between the lists. Then use the matrix to iterate and fill in the elements of the longest common subsequence list."
239,How can you get the key associated with the maximum value in a dictionary ?,"my_dict = {1: 2, 3: 4, 5: 3, 6: 5}","Use the max() method to get the key associated with the maximum value in a dictionary. max(my_dict, key=my_dict.get) will return the key associated with the maximum value in the dictionary."
240,How can you implement a counting sort algorithm ?,"my_list = [1, 4, 1, 3, 5, 4, 2, 3]","Use an auxiliary array to track the count of each element in the list. First initialize the auxiliary array with the length same as the maximum element in the list. Then iterate over the list and increase the count at the index corresponding to the current element. Finally, fill the output array with the elements in order of their count."
241,How can you print an array of strings with a space in between ?,"strings = [""Hello"", ""World"", ""Goodbye""]","print("" "".join(strings))"
242,How can a c{List } be sorted in ascending order?,"myList[ 3, 4, 2, 1]","The list can be sorted in ascending order using the list sort() method, which sorts the elements in the list in the natural ordering of its elements, such as the numeric or lexicographical ordering: myList.sort() #myList is now [1, 2, 3, 4]"
243,How can a l{Dictionary } in Python be updated ?,"myDict = {'a':1, 'b':2}","A dictionary in Python can be updated by using the update() method, which takes in one or more key-value pairs and adds them to the existing dictionary: myDict.update({'c':3, 'd':4}) #myDict is now {'a':1, 'b':2, 'c':3, 'd':4}"
244,How can multiple dictionaries be merged into one ?,"d1 = {'a':1, 'b':2}
d2 = {'c':3, 'd':4}","Multiple dictionaries can be merged into one dictionary by using the update() method, which takes in one or other dictionary as the argument and merges the two dictionaries into one:
d1.update(d2) #d1 is now {'a':1, 'b':2, 'c':3, 'd':4}"
245,How can an object be serialized in Python ?,myClass = MyClass(),"Objects can be serialized in Python using the pickle module which provides the dump() and load() functions. pickle.dump(myClass, open('myClass.pickle', 'wb')) #serialize object to binary file pickle.load(open('myClass.pickle', 'rb')) #deserialize object from binary file"
246,How can an object's attributes be accessed ?,"class MyClass():
    def __init__(self):
        self.var1 = 'a'
        self.var2 = 'b'","Objects in Python can have their attributes accessed using the dot notation, where the attribute name is given after a dot after the object name. For example, in the above example, the variables var1 and var2 of the object myClass can be accessed using the code myClass.var1 and myClass.var2 respectively."
247,How can a l{generator } be used to iterate over a list in Python ?,"myList = [1,2,3,4]","Generators can be used to iterate over a list in Python using the generator function, which yields each element of the list one by one. For example, for the list myList given above, the generator expression (x for x in myList) can be used to iterate over the list, yielding each item of the list one by one."
248,How should you modify the output?,def modified_output out decode out out utf 8 out reverse out out join out,"decode the output string to utf-8, reverse it, then join each character of the reversed string together."
249,How can an array be filled with a default value?,"import numpy as np 
arr = np.zeros(10) 
default_value = 5",arr.fill(default_value)
250,What should you return at the end of this function?,"def parse_data data
    result = []
    for d in data:
        result.append(d +1)","At the end of this function, the list result should be returned, which contains the elements from the data list with 1 added to each element."
251,What can you do to prevent a TypeError?,,TypeError can be prevented by correctly handling type conversion and explicit argument type checking. The function should be designed to accept dynamic data types and return appropriate results.
252,How can you detect a type of an object ?,,"You can detect the type of an object by using the type() function. The type() function takes in an object as an argument and returns the type of the given object. For example, the type() function applied to the number 5 would return int."
253,How can we apply Logistic Regression on a data set ?,"import numpy as np
import pandas as pd

data = pd.read_csv('sample_data.csv')","Logistic regression can be applied to a data set by creating a model that maps the features of the data set to the target variable. This can be done using the LogisticRegression() function in the sklearn library. The LogisticRegression() function takes in the input features and the output target variable as arguments. Once the model has been created, the model.fit() method can be used to fit the model on the data set."
254,How can we define a function ?,,"A function can be defined using the def keyword followed by the name of the function and the parameters the function takes as arguments in parenthesis. The body of the function is specified in an indented block of code below the function definition. For example, the following will define a function that takes two numbers and returns their sum:

def add(a,b):
    return a + b"
255,How can we get input from the user ?,,"The user can provide input to a Python program by using the built-in input() or raw_input() functions. The input() function takes a string as an argument and prints it to the screen, then returns the text that the user entered. The raw_input() function is similar to input() but reads in the input as a string without printing it."
256,How can we test a condition in Python ?,,"A condition can be tested in Python with the if statement. The if statement takes a Boolean expression as an argument and evaluates it. If the expression is true, the statements inside the if statement are executed. If the expression is false, the statements inside the if statement are skipped."
257,How can we handle an exception ?,,"An exception can be handled in Python by using a try-except block. The try-except block takes a try statement, which contains the code that has the potential to raise an exception, and an except statement, which contains code to be executed if the exception is raised."
258,How can we remove duplicates from a list ?,"my_list = [1, 2, 3, 3, 4, 5, 6, 6, 7, 8, 8]","Duplicates can be removed from a list by using a set. The set() method in Python creates a set from the given list, which internally removes any duplicate elements. The resulting set can then be converted back to a list with the list() method, which will now contain only unique elements from the original list."
259,How can we invoke a method ?,,"A method can be invoked in Python by using the object that the method belongs to and passing in any necessary arguments. The object's name is followed by the method name and any necessary input arguments in parentheses. For example, if an object x has a method called my_method, it can be invoked as follows: x.my_method(argument1, argument2, ...)."
260,How can you iterate through a list ?,"letters = [""a"", ""e"", ""i"", ""o"", ""u""]","Iterate through a list using a 'for' loop. For example, if you want to print out each element in the list letters, you can use code like this: for l in letters: print(l)"
261,Is there a way to remove an item from a list ?,,"Yes, you can remove an item from a list by using the built-in list.remove() method. For example, if you want to remove the item ""apple"" from a list of fruits, you can use code like this: fruits.remove(""apple"")"
262,What is a Dictionary and what are some of its methods ?,,"A Dictionary is an unordered collection of key-value pairs (also known as associative array or hash table). Some of the methods used to manipulate dictionaries include get() for retrieving a specific item in the dictionary, put() for adding a new item to the dictionary, update() for updating an existing item in the dictionary, and remove() for removing an item from the dictionary."
263,What are the exceptions for python ?,,"The exceptions for Python are BaseException, Exception, LookupError, StandardError, ArithmeticError, AssertionError, AttributeError, EOFError, ImportError, KeyboardInterrupt, MemoryError, NameError, NotImplementedError, OSError, ReferenceError, RuntimeError, SyntaxError, SystemError, TypeError, ValueError, Warning and more."
264,What is a method to slice a string?,"mystring = ""This is my string to be sliced""","Slicing strings can be done in Python with the use of the index notation and colon (:). For example, in our example string, to obtain the first 4 characters we can use the notation mystring[0:4]. This returns 'This'. To obtain the last 5 characters, the notation would be mystring[-5:]. This would return 'sliced'."
265,What is the proper way to use split in Python?,,"The “split()” method is used to split a string into a list based on a specified delimiter. For example, you can split a sentence into individual words by using the whitespace character as the delimiter: mystring.split(' '). This would return a list of each individual word in the string."
266,Can you explain the difference between range and xrange functions in Python?,,"The range() function returns a list of numbers, while the xrange() function returns an iterator object. The range() function is more suitable for larger ranges, since it creates the whole list in memory before returning it. The xrange() function is more efficient in memory usage since it generates numbers on the fly, while having the same functionality as range()."
267,What is the syntax to raise an exception in Python?,,"To raise an exception in Python, the syntax is:

raise ExceptionName(arguments).

For example if you wanted to raise a ValueError exception, you would use the following syntax:

raise ValueError('Invalid Value')."
268,"In Python, what is the purpose of the help() function ?",,"The help() function is used to display a help message for an object, class, or module, listing the available attributes and methods, and providing useful information about them."
269,What is a global statement in Python ?,,A global statement is a statement in Python that allows the user to declare global variables that will be available throughout the program.
270,Construct a loop that will iterate through a list of numbers and print out the square of each number.,"@numlist@ [2, 4, 6, 8, 10]","for number in numlist:
  print(number ** 2)  # printing the square of the number"
271,Write a code snippet that creates a module with two functions.,,"def func1():
    print('First function in a module')
    
def func2():
    print('Second function in a module')"
272,How can you accept a variable number of arguments in a Python function ?,,A variable number of arguments can be accepted in a Python function using the *args syntax in the function definition. This allows for arguments to be passed in as a list of values and enables the function to be called with any number of arguments.
273,Write a class to generate an object that stores a list of property values.,,"class PropertyList:
    def __init__(self, *property_vals):
        self.property_vals = property_vals
    
    def get_list(self):
        return self.property_vals"
274,Construct a statement which prints out successive powers of 3 up to 100.,,"for i in range(4):
    print(3 ** i)  # prints successive powers of 3 up to 3^3 = 27"
275,Write a code snippet which calculates the highest and lowest marks from a list of marks.,"@marks@ [43, 75, 92, 12, 84, 99]","# calculating the highest and lowest marks
highest_mark = max(marks)
lowest_mark = min(marks)
print('The highest mark is {}, and the lowest mark is {}'.format(highest_mark, lowest_mark))"
276,How can you use an if statement to check if a certain element exists in a list ?,,"You can use an if statement to check if a certain element exists in a list by looping through the list and using the keyword 'in' to check if the element is in the list. For example:

mylist = [1, 2, 3, 4]
if 5 in mylist:
    print('Element exists in list')
else:
    print('Element does not exist in list')"
277,Write a code snippet which generates a list of random numbers from 1 to 10.,,"import random
random_numbers = [random.randint(1, 10) for _ in range(10)]"
278,How can you modify an existing list in Python in-place ?,,"To modify an existing list in Python in-place, you can use its built-in methods to modify the elements in the list, such as append(), extend(), pop() or remove(). For example:

mylist = [1, 2, 3]
mylist.append(4)  # appends 4 to the end of the list 
mylist[2] = 5  # modifies the 2nd element of the list to 5"
279,Create a while loop which prints all integers between 5 and 10 (inclusive).,,"num = 5
while num < 11:
    print(num)
    num +=1"
280,How can you iterate in the list of items ?,"mylist = [12, 17, 27, 48]","for item in mylist:  # iterate through the list of items 
    print(item)  # printing the item in the list"
281,How can you sum all the numbers in a list of tuples?,"nums_list = [(1, 4), (5, 6), (2, 7)]","total_sum = 0
for tup in nums_list:  # iterate through the tuples 
    total_sum += tup[0] + tup[1]  # add each tuple's elements 
print(total_sum)  # this will print 18"
282,How can you check if a string contains only numbers?,"mystring = ""1239012""","if mystring.isdigit():  # This will return True if the string contains only digits 
    print(""Only numbers"") 
else: 
    print(""Contains something else"")"
283,How can you sort the elements of a list alphabetically?,"mylist = [""Cat"", ""Dog"", ""Mouse"", ""Ant""]",mylist.sort(key=str.lower)  # This will sort the elements of the list alphabetically
284,How can you access a dictionary value by its key?,"kvdict = {""Key1"": 2, ""Key2"": 4}","a = kvdict[""Key1""]  # This will assign the value 2 to the variable a"
285,How can the following be converted into a pandas DataFrame ?,"data = {
    'name': [""John"", ""Jane"", ""Jack""],
    'age': [21, 20, 19],
    'address': [""UK"", ""US"", ""India""],
}","import pandas as pd

df = pd.DataFrame(data)"
286,How can you convert a Pandas DataFrame into a 2D NumPy array ?,"import pandas as pd

test_df = pd.DataFrame({ 'A': [1, 2, 3], 'B': [4, 5, 6] })","You can use the DataFrame.values attribute to convert a Pandas DataFrame into a 2D NumPy array.  This will return the underlying data of the DataFrame as a NumPy array.

For example, given the test_df DataFrame declared above, we can convert it into a 2D NumPy array by calling its values attribute: 

test_df_arr = test_df.values

# test_df_arr is now a 2D NumPy array"
287,How can you retrieve the element in the fourth position in an array ?,"arr = [1,2,3,4,5]","To retrieve the element in the fourth position in an array, you can use the array indexing syntax. The index of the fourth element in the array is 3, so you can use the following statement to retrieve the fourth element:

arr[3] # returns 4"
288,What is the data type of the following variable ?,"x = ['apple', 'banana', 'cherry']",The data type of the variable x is a list.
289,How can you replace the last element of the list ?,"my_list = [1, 2, 3, 4]","To replace the last element in the list, you can use indexing. The index of the last element in the list is -1, so you can use the following statement:

my_list[-1] = 'new element' # replaces the last element in the list"
290,How can you insert a new element at the beginning of the list ?,"my_list = [1, 2, 3, 4]","To insert a new element at the beginning of the list, you can use the insert() method. This method takes two arguments: the index of the position to insert the element, and the element itself. To add a new element at the beginning of the list, you need to specify 0 as the index.

For example:

my_list.insert(0, 'new element') # inserts the element at the beginning of the list"
291,How can you access the third element of a 2D NumPy array ?,"import numpy as np 
arr = np.array([[1,2,3], [4,5,6], [7,8,9]])","To access the third element of the 2D NumPy array, you can use array indexing. Since the 2D array has two dimensions, two indices need to be specified in order to access an element. The index of the third element in the array is [0, 2], so you can use the following statement:

arr[0, 2] # returns 3"
292,How can you set a variable's value in the given code ?,def var_value x,Set the value of `x` by using the syntax `x = <value>`.
293,How can you handle exceptions with Python ?,,"Handle exceptions with Python by using the `try` and `except` statements to catch and handle errors. For example: `try:
    # some code here
except Exception as e:
    print(e)`."
294,How can you convert a function into a lambda expression ?,def my_func n1 n2 n3: return n1 + n2 - n3,"Convert the given function to a lambda expression by using the syntax `lambda n1, n2, n3: n1 + n2 - n3`."
295,How can you multiply a matrix by a scalar ?,,"Multiply a matrix by a scalar by performing the multiplication operation on each element of the matrix. For example, given a 2x2 matrix `A` and a scalar `c`, the result will be `A' = cA`."
296,How can you check if a number is prime ?,,"Check if a number is prime by looping over the numbers from 2 to `n-1` and checking if any of them divides `n` without a remainder. If the number is divisible by any of the numbers, then it is not a prime."
297,How can you change the value of a global variable inside a function ?,,Change the value of a global variable inside a function by using the `global` keyword. For example: `x = 0` `def my_func():` `    global x` `    x = 1` `my_func()` `print(x)`
298,How can you create an empty list?,,"You can create an empty list by using the list() function with no arguments. For example, to create an empty list, use my_list = list(). This will create an empty list with no items."
299,How can you access all the keys in a dictionary?,"my_dict = {""a"": 1, ""b"": 2, ""c"": 3}","You can access all the keys in a dictionary by using the keys() method. For example, to access the keys from my_dict, use my_dict.keys(). This will return a list of all the keys in the dictionary, which is [""a"", ""b"", ""c""]."
300,How can you update a dictionary with a new key-value pair?,"my_dict = {""a"": 1, ""b"": 2, ""c"": 3}","You can update a dictionary with a new key-value pair by using the update() method. For example, to add a new key-value pair to my_dict, use my_dict.update({""d"": 4}). This will add the key ""d"" with the value 4 to the dictionary."
301,How do you remove a key-value pair from a dictionary?,"my_dict = {""a"": 1, ""b"": 2, ""c"": 3}","You can remove a key-value pair from a dictionary by using the pop() method. For example, to remove the key-value pair with the key ""b"" from my_dict, use my_dict.pop(""b""). This will remove the key ""b"" and its associated value from the dictionary."
302,How can the GPT model describe the purpose of this code ?,def unique filename with path path num 0 file name path split '.' 0 for f in listdir path if isfile path join path f if file name in fnum num = num 1 if num == 0 return f else return file name num,This code creates a unique filename with path by incrementing the numerical suffix if the file name already exists in the specified path. It returns the unique filename with path.
303,How can you assign the value ‘yellow’ to the string ‘color’ in a dictionary ?,,dictionary[ 'color' ] = 'yellow'
304,How can you comment out a line of code in Python ?,,#comment the line of code
305,What is the maximum element in the list ?,"list_a=[4, 6, 8, 8, 5, 3, 6]",The maximum element in the list is 8.
306,How can you calculate the difference between the largest and the smallest element of a given list ?,"list_b = [2, 7, 1, 8, 10]",difference = max(list_b) - min(list_b)
307,How can you remove stop words from a given sentence ?,"sentence = ""I am testing a GPT model""",sentence_without_stopwords = ' '.join([word for word in sentence.split() if word.lower() not in stopwords.words('english')])
308,How do you check if an item exists in a given dictionary ?,"d = {'a':1, 'b':2, 'c':3}","if 'a' in d: 
    # exist in dictionary
    print(""Exist in dictionary"") 
else: 
    print(""Does not exist in dictionary"")"
309,How can you write a function that will accept a list of numbers and return a dict with the maximum of each set of numbers?,"list_of_numbers = [[1, 7, 4], [0, -4, 19], [6, 4, 1], [-2, 8, 3]]","def get_max(list_of_numbers): 
    max_dict = dict() 
    for numbers in list_of_numbers: 
        max_dict[tuple(numbers)] = max(numbers) 
    return max_dict 

print(get_max(list_of_numbers)) # {(1, 7, 4): 7, (0, -4, 19): 19, (6, 4, 1): 6, (-2, 8, 3): 8}"
310,"What is the purpose of the "" with "" statement in this code?","with open(""myfile.txt"", ""w"") as file_obj:
    file_obj.write(""hello world"")","The ""with"" statement is used to ensure that the file is properly closed after the code block inside the ""with"" statement is executed, even if an exception is raised. The clean-up action of the ""with"" statement will be executed regardless of whether the code block inside of it is successful or not. This makes the code neater and more secure."
311,Can you take advantage of Python's set types to improve the performance of this code ?,"def lengthSum(listOfStrings):
sumTotal = 0

for string in listOfStrings:
    sumTotal += len(string)
    
return sumTotal","Yes, by taking advantage of Python's set types, you can improve the performance of this code. For example, you could convert the list of strings into a set of strings and then measure the length of the set rather than the length of each string. This would reduce the amount of loop iterations and the overall time required for this operation."
312,Can you write a function to convert a string of characters to a list of words?,"string_to_convert = ""Lorem ipsum dolor sit amet.""","Yes, you can write a function to convert a string of characters to a list of words. This can be done using the split() function. The following code snippet does this: string_to_convert.split(' '), which returns a list of words in the string (in this case [""Lorem"",""ipsum"",""dolor"",""sit"",""amet.""])."
313,How do you apply the filter function to a list in Python?,"my_list = [1, 2, 3, 4, 5]","To apply the filter function to a list, you can use the following syntax: `filtered_list = list(filter(lambda item: condition, my_list))`, where condition is a predicate given to determine which elements to keep and which to leave out. For example, using this syntax, the filtered_list could be modified to only contain the even numbers in my_list by replacing condition with `item % 2 == 0`."
314,How can you ensure that a given function is only called once in a given program?,"def foobar():
    print('hello world')","You can ensure that a given function is only called once in a given program by using a singleton pattern. This involves defining a class for the function, and implementing the __init__() method to return the instance of the class if it has already been created. Then, in order to use the function, you should call the instance of the class, instead of the function name. This way, since the instance is only created once, the function will only be called once."
315,How can you convert a string of comma separated numbers into a list of integers?,"string = ""1, 2, 3, 4, 5""","You can convert a string of comma separated numbers into a list of integers using the split() and map() functions. The following code snippet does this: list_of_integers = list(map(int, string.split(','))) , which returns a list of integers - [1, 2, 3, 4, 5]."
