,instruction,input,output
0,What is the value of variable b in the following code snippet?,"a = 5
b = 10",10
1,What is the difference between range and xrange?,,"The main difference between range and xrange is that range returns a list while xrange returns an object that generates the numbers on demand. Range is a more memory-intensive function as it creates the whole list at once, while xrange is a more efficient function since it only creates one number at a time."
2,How can you remove the last item of a list?,"list = [1, 2, 3, 4, 5]","The last item of the list can be removed by using the pop() method, which removes the item at the given index or the last item if no index is specified. list.pop() will remove the last item in the list and return its value."
3,What is the syntax to check if a list contains an element?,"list = [1, 2, 3]","To check whether a list contains an element, the syntax is 'element in list', for example, to check if the list contains the element 2, the syntax would be '2 in list'. This expression will evaluate to a boolean value of True or False."
4,How can you delete an element from a dictionary?,"dictionary = {'name' : 'Bob', 'age' : 16, 'gender' : 'Male'}","An element of a dictionary can be deleted by using the del keyword. The syntax is del dictionary['key'], where 'key' is the key of the element that needs to be deleted. Therefore, to delete the element with key 'age' from the dictionary, the command would be del dictionary['age']."
5,What would be the output of the following code?,"d = {1: 'one' , 2: 'two', 3: 'three'}
list1 = [1,2,3]
for k in list1:
    print(d[k])","The output of this code would be ""one two three"", since the for loop iterates through the list and prints the corresponding values of each key from the dictionary."
6,How can you create a new dictionary from an existing one?,"d = {1: 'one', 2: 'two', 3: 'three'}","A new dictionary can be created from an existing dictionary using the dict() constructor. The syntax is dict(d), where d is the existing dictionary. This will create a shallow copy of the original dictionary, containing the same keys and values."
7,How do you create a two-dimensional array in Python?,,"A two-dimensional array can be created in Python by using the nested list structure, which is a list of lists. The syntax is array = [[0]*n]*m, where n is the number of columns and m is the number of rows. This will create a two-dimensional array of size m x n with all elements set to the value 0."
8,How can you check if a string ends with a certain substring?,"string = ""Hello World""","To check if a string ends with a certain substring, the syntax is string.endswith(substring), where string is the main string and substring is the ending substring to be checked. Therefore, to check if the string ""Hello World"" ends with the substring ""orld"", the syntax would be ""Hello World"".endswith(""orld""). This expression will evaluate to a boolean value of True or False."
9,How do you invoke the help function for a Python module?,,"The help function for a Python module can be invoked by using the help() function. The syntax is help(module), where module is the name of the module for which help is required. This function will return the help documentation for the module."
10,How can you make a copy of a list?,"list = [1, 2, 3]","A copy of a list can be created in Python by using the slice technique. The syntax is listcopy = list[:], which will create a shallow copy of the original list. This copy contains the same elements as the original list, however any changes to either list will affect both."
11,How can you remove a single element from a list ?,"list = [1,2,3,4]",list.remove(element) #element is the element to be removed from the list.
12,How can you check if a character is an alphabet in Python?,,"if character.isalpha(): # character is the character to be checked   #this will return True if the character is an alphabet, and False otherwise."
13,What type of annotation can be used for keyword argument defaults?,,"The annotation for keyword argument defaults can be either an expression or a type annotation. For example, the keyword argument default for `x` is `3` which is expressed with an expression annotation `x: int = 3`."
14,What is the syntax to process a list into a new one containing the uppercase of each element?,"list = ['one', 'two', 'three']","new_list = [word.upper() for word in list] # this will produce the list ['ONE', 'TWO', 'THREE']"
15,How can you find the maximum value in a list of numbers?,"list = [3, 5, 9, 1, 4]",max_value = max(list) # this will return 9 as the maximum value in the list.
16,How can you reverse the order of the elements in a set?,"set1 = {'a', 'b', 'c'}","rev_set = reversed(list(set1)) # this will produce a reversed form of the set {'c', 'b', 'a'}."
17,What does the 'del' statement do in Python?,,"The 'del' statement can be used to delete an element or a part of an element from a list, set or dictionary. For example, del l[2] will delete the third element of the list l. Also, del d['age'] will delete the 'age' element from the dictionary d."
18,How can you convert a string to upper case in Python?,string = 'hello world',uppercase_string = string.upper() # this will produce the string 'HELLO WORLD'.
19,How can you print all items in a dictionary in a sorted order?,"d = {'b':1, 'c':2, 'a':3}","for item in sorted(d.items()): print(item) # this will print (('a', 3), ('b', 1), ('c', 2))."
20,How can you return an iterator from a function in Python?,,"The function should use the 'yield' keyword to return an iterator. For example, a function which returns a range of integers from 0 to 10 can be written as follows: 

def int_range():
    for i in range(10):
        yield i

This function returns an iterator which produces the values from 0 to 10."
21,What is the equivalent of the break statement in a while loop in Python?,,"The equivalent of the break statement in a while loop in Python is the 'continue' statement. The continue statement can be used to force an early end to the current loop iteration, and jump directly to the condition evaluation of the loop."
22,How can you create a dictionary from two different lists?,"list1 = [1,2,3] 
list2 = ['a', 'b', 'c']","dictionary = dict(zip(list1, list2)) # this will create a dictionary {1:'a', 2:'b', 3:'c'}."
23,How can you check if a substring exists in a string?,"string = 'Hello, world'","if 'world' in string: # this will check if the substring 'world' exists in the string 'Hello, world' and will return True if it exists, and False otherwise."
24,How can you remove the whitespaces from a string?,string = '  Hello   World  ',string_no_spaces = string.strip() # this will remove leading and trailing whitespaces and produce a new string 'Hello   World'.
25,What changes should be made to the below code to raise an exception ?,def add items to set value if value not in set raise Exception 'Value already exists in set' else set add value,"To raise an exception in the above code, an appropriate exception class should be specified. The appropriate class should be specified as the first argument of the raise statement. For example: ""raise ValueError('Value already exists in set')"". This will raise a ValueError exception if the specified value already exists in the set, thereby blocking the addition of the value to the set."
26,Rewrite the below code to use classes,"users_info = {}

def add_info_to_user(username, email, age):
    users_info[username] = {'email': email, 'age': age}

def get_info_from_user(username):
    return users_info.get(username, None)","class User: 
    def __init__(self, username, email, age):
        self.username = username
        self.email = email
        self.age = age

users_info = {}

def add_info_to_user(user):
    users_info[user.username] = user

def get_info_from_user(username):
    return users_info.get(username, None)"
27,How does the code create an instance of the Counter class ?,from collections import Counter counter = Counter,"An instance of the Counter class is created by calling the Counter constructor and passing in the data to be counted. This can be done by either passing in an iterable as an argument or calling the update() method and passing in an iterable. The syntax for this would be ""counter = Counter(iterable)"", where iterable is the data to be counted, or ""counter = Counter()"" followed by ""counter.update(iterable)""."
28,What changes should be made to the code so that it creates a class ?,def add number num add_to num + 1,"To turn the code into a class, an appropriate class keyword should be used to define the class, and the function should be defined as a method of the class. This can be achieved by changing the code to the following:

class AddNumber:
    def __init__(self, num):
        self.num = num

    def add_to(self):
        self.num += 1"
29,How will the code execute the function for each item in the list ?,"my_list = [2, 4, 6]

def print_item(item):
    print(item)","The code can execute the function print_item() for each item in the list using a loop. This can be done using a for loop such as:

for item in my_list:
    print_item(item)"
30,How can you transform the code into a reusable generator ?,"numbers = [1, 2, 3, 4]

for number in numbers:
    print(number ** 2)","To transform the code into a reusable generator, the for loop should be replaced with a generator function. The generator function should be used to yield values instead of returning them. This can be done with the following code:

def generate_squares(numbers):
  for number in numbers:
    yield number **2

numbers = [1, 2, 3, 4]

for number in generate_squares(numbers):
  print(number)"
31,What changes should be made to the code for it to access the dictionary item ?,"my_dict = {'name': 'John', 'age': 25}

my_dict['name']","No changes need to be made to the code in order for it to access the item in the dictionary. This can be done by using square bracket notation with the key of the item to be accessed. In this case, the code should look like my_dict['name'], which will return the value for the 'name' key."
32,How could you edit the code to print the fibonacci sequence until the 15th term ?,def Fibonacci n terms current next 1 for i in range n terms print current current current next next current next,def Fibonacci n terms current next 1 i 0 while i<15 print current current current next next current next i+=1
33,How can you output a string from the given code ?,def message text print text messages message hello,def message text print 'hello' messages message hello
34,How can you modify the code to change the logic of the function ?,def read file fname data open fname data.readlines fname close data,def read file fname data set [] open fname for line in data.readlines: set.append line fname close data return set
35,What can be used to access the first item in the list ?,"my_list = [1, 2, 3, 4, 5]",my_list[0] can be used to access the first item in the list.
36,How can you print each item in the list one by one ?,"my_list = [1, 2, 3, 4, 5]",for item in my_list: print(item) can be used to print each item in the list one by one.
37,How can you add an item to a list ?,"my_list = [1, 2, 3, 4, 5]",my_list.append(6) can be used to add an item to the list.
38,How can you remove an item from the list ?,"my_list = [1, 2, 3, 4, 5]",my_list.remove(3) can be used to remove an item from the list.
39,How can you sort the list in descending order ?,"my_list = [5, 4, 3, 2, 1]",my_list.sort(reverse=True) can be used to sort the list in descending order.
40,What is the output of this code ?,def mystery a b c return a 2 c b,the output of the code is a**2*c + b.
41,How can you detect the type of a variable ?,"my_var = 'Hello, World!'",type(my_var) can be used to detect the type of a variable.
42,How can you conditionally execute a piece of code ?,x = 15,if x == 15: can be used to conditionally execute a piece of code.
43,How can you create a function that takes in a list of strings ?,"my_list = ['hello', 'world', 'foo', 'bar']",def func(string_list): can be used to create a function that takes in a list of strings.
44,How can you parse a string into a dictionary ?,"my_str = 'name: John, age: 10'","dict(s.split(':') for s in my_str.split(', ')) can be used to parse a string into a dictionary."
45,How can you convert a string into an integer ?,,"one could use the int() function available in Python to convert a string to an integer. For example, int(""123"") returns 123 as an integer."
46,How can you override an existing method ?,,One can override an existing method by using the same method name in a child class and redefining it.
47,How can you compare two strings ?,,"Two strings can be compared using the cmp() function in Python. This function takes two arguments and returns an integer indicating the result of the comparison of the two strings. It returns 0 if the two strings are equal, 1 if the first string is greater and -1 if the second string is greater."
48,How can you insert an element into a list ?,,"One can insert an element into a list using the insert() method of the Python list module. The syntax for insert() is list.insert(index, element) and it inserts the element at the given index in the list."
49,How can we reset a password for a user ?,def reset_password user return user set_password,user.set_password() to reset the password for the given user.
50,How can a count of circles be calculated ?,import arraycircle_radius radius_array np array length radius_array,count_circles = len(circle_radius) // To calculate the count of circles with given radius array.
51,How can the integrity of a directory be preserved?,import os def check_dir path for root dirname dirs files in os walkpath os makedirs root dirname,by creating the directory if it does not exist and checking for consistency of directory structure and content with os.walk()
52,How could we check if an item is in a list?,"items = [8, 7, 9, 3]",if item in items: # check if an item is in the list items.
53,How can you modify the title of a figure?,"import matplotlib.pyplot as plt fig, ax = plt.subplots ()","ax.set_title(""My Figure Title"") # to modify the title of a figure."
54,How can the lengths of multiple lists be equalized?,"list_a = [9, 10, 11]
list_b = [1, 4]",list_b.extend(len(list_a) - len(list_b)*[None]) # to equalize the lengths of multiple lists by extending list_b with None values.
55,How can a user be authenticated?,,By verifying the user credentials from an authentication provider like OAuth.
56,How can a tuple be converted into a list?,"tuple = (11, 25, 17, 5, 8)",list = list(tuple) # to convert the given tuple into a list.
57,How can a key be checked if it exists in a dictionary?,"sample_dict = {‘a’:1, ‘b’:3, ‘c’:4}",if 'key' in sample_dict: # to check if a key exists in the given dictionary.
58,How can a Django app be run?,,"By executing the command ""python manage.py runserver"" in the root directory of the Django app."
59,How can a set be subsetted?,"x = {‘a’, ‘b’, ‘c’, ‘d’, ‘e’, ‘f’, ‘g’}","y = x.intersection({'b', 'e', 'f'}) # to subset a set from another set."
60,How can a user be removed from a system?,,"By executing removal code for the given user, such as deleting user records or updating user access permissions."
61,How can you simulate a function based on two parameters list and value ?,def simulate lst value,"Loop through the list and compare each item to the given value, if they match, return True, otherwise return False."
62,How can we format numbers dynamically ?,def dynamic_number_format n,"Use string formatting to dynamically format the number, depending on its size. For example: `'{:,}'.format(n)` to display 4 digits grouped by comma."
63,How can you retrieve elements from a list ?,"list = [1,2,3,4]","Access the desired elements from the list using the list index, for example `list[2]` to access the 3rd element (index starting with 0)."
64,What can we do to change data types in a list ?,"list = [1, 2.5, 3, 4]","Loop through the list and convert each element to the desired data type with the built-in function, e.g.`int(item)` for integer or `float(item)` for float."
65,What type of loop should be used to iterate over multiple sequences ?,"list_x = [1,2,3]
list_y = [4,5,6]","A nested loop should be used to iterate over the two lists simultaneously, such as a `for` loop nested inside another `for` loop. Then the elements in each iteration can be accessed with `list_x[i]` and `list_y[i]`."
66,How can you check if two sets are equal ?,"set_a = set(range(1,5))
set_b = set(range(1,5))",Check if two sets are equal by using the built-in `== operator` or `==` operator. This will compare the contents of both the sets and return `True` only if they are equal.
67,What is the right way to create a Python dictionary?,,"Python dictionaries can be created using the built-in `dict()` function, or by simply putting the key-value pairs between curly braces `{}`."
68,How can you print the length of a tuple ?,"t = (1,2,3)","Print the length of the tuple by using the built-in `len()` function, for example `print(len(t))` which will return 3."
69,What is the best way to remove elements from a list ?,"list = [1,2,3,4,5]","Remove elements from a list by using the built-in `del`statement, passing the list index of the element to delete. For example: `del list[3]` removes the 4th element from the list."
70,What can you do to remove duplicates from a list ?,"list = [1,1,2,2,3,3]","Remove duplicates from a list by using a `set()` to convert the list into a set, which only contains unique items, and then convert it back to a list. For example, `list = list(set(list))`."
71,How can you get the indices of an element in a list ?,"list = [1,2,3,4,5]","Get the indices of an element in a list by using the built-in `index()` function, which returns the index of the first occurrence of the given element in the list. For example, `list.index(3)` will return 2."
72,How can you split a list into chunks ?,"list = [1,2,3,4,5]","Split a list into chunks by using `zip(*[iter(list)]*n)`, where `n` is the desired size of the chunk. This will return an iterator of tuples, each containing `n` items from the list. For example, `list(zip(*[iter(list)]*2))` will return `((1, 2), (3, 4), (5, ))`."
73,How can you convert a list to a string ?,"list = [1,2,3,4,5]","Convert a list to a string by using the built-in `join()` method. This will take a list of strings and join them together into a single string. For example,`str(list).join(list)` will return '1,2,3,4,5'."
74,How is an element accessed in a list?,,"An element in a list can be accessed by its index. For example, if the list contains the elements ['a', 'b', 'c'], the element 'b' can be accessed by its index of 1 (the index starts at 0). To access an element from the list, use the syntax `list[index]`, where `list` is the name of the list and `index` is the index of the element that is to be accessed."
75,What data type is returned by this function?,def typecast_to int num try num int except Value Error return default,The function returns an integer data type.
76,Which Python variable type is used?,def init zip_data zip_code self zip_code zip_code self data zip_data,The function uses a Python variable of type dictionary (dict) to store the zip code and related data.
77,How is dp[i] calculated?,def knapsack weight i if i == 0 return 0 for j in range 0 i if weight[i] > j dp[i] max dp[i] dp[i j] weight[i j] 1,"dp[i] is calculated by taking the maximum value between dp[i] which stores the maximum value for a given weight, and the value of dp[i-j] + weight[i] + 1 which is the sum of the current weight, and the maximum value for the remaining weight."
78,How is str.find() used?,def substring str1 str2 index str 1 0 index while index != -1 if str1 str 2 index : return True index str1 find str2 index 1 return False,str.find() is used to search for a given substring in a string. It returns the index of the first occurrence of the substring or -1 if the substring is not present.
79,How can you modify the code?,def say_hello name print 'Hello !' name,"the code can be modified by changing the print statement to say ""Greetings, %s!"" % name"
80,How can you access an element in the list?,,"A specific element can be accessed from the list by using the index associated with the element, e.g. list[3] would access the fourth element in the list."
81,What is the code trying to accomplish?,def compute volume list result for n in range 1 len list result += list n ** 3,"The code is attempting to calculate the volume of a list by iterating through the list and summing the cube of each element, i.e. result += list n ** 3"
82,How can you print the elements in a list separated by commas?,"mylist = [2, 4, 6, 8]","The elements in the list can be printed with commas inbetween by using a for loop and joining the elements together with the join() method, e.g. for item in mylist:
    print("","".join(item))"
83,How can you add two lists together?,,"Two lists can be combined together using the extend() or + methods, e.g. mylist1.extend(mylist2) or mylist1 + mylist2."
84,How can you generate a matrix using nested lists?,,"A matrix can be generated using nested lists, e.g. [[1,2,3], [4,5,6], [7,8,9]], where each nested list is a row in the matrix."
85,How can we create an exception trapping mechanism in our code ?,"def find_words_in_text(text):
    words = []
    #Your code goes here
    for line in text.splitlines(True):
        words+=re.findall(r'\w+', line)
    return words","try:
    words = find_words_in_text(text)
except Exception as e:
    print('Error:',e)
    sys.exit(1)  # Exit with an error code
else:
    # Do something with the words
    print(words)"
86,What are the explicit and implicit assumptions we are making when we use a Python Dictionary?,,"The explicit assumptions when using a Python dictionary are that its values can be any immutable type, the keys must be of an immutable type such as a string or a number, and that the keys must be unique. Implicit assumptions include that the dictionary will never need to store more than 4 billion entries, entries can be quickly found or added, and the order of the entries will be preserved. Additionally, some implicit assumptions which may not always hold true include that the keys must be hashes, and that the iterators will be in the same order as the insertion order."
87,How can someone check if a list is empty in python ?,,"The simplest way to check if a list is empty in Python is to compare the length of the list to 0. This can be done either in an if statement or using a Boolean expression. For example,  if len(list) == 0:  or if not list:  will both evaluate to True for an empty list."
88,What is the best way to write a function to print out the elements of an array in descending order ?,"arr = [4,6,3,2,1]","def descending(arr):
    for i in range (0, len(arr), 1):
        greatest = 0
        for i in range(len(arr)):
            if arr[i] > arr[greatest]:
                greatest = i

        print(arr[greatest])
        arr.remove(arr[greatest])

descending(arr)"
89,How can we close a database connection with python ?,"conn = sqlite3.connect (""mydatabase.db"")","To close a database connection with Python, call the close() method on the connection object. In this example, you would do:
conn.close()"
90,What are the advantages and disadvantages of using lists over tuples in python ?,,"The major advantages of using lists over tuples in Python is that lists are mutable, which means they can be changed in place whereas tuples are immutable. Additionally, lists use less memory and are easier to work with when dealing with larger data sets. 

The major disadvantage of using lists is that they can contain any type of data, which can introduce bugs. Furthermore, since lists are mutable, it can be difficult to ensure data integrity when multiple variables are referencing the same list. Tuples on the other hand, can only contain a limited set of objects, and are immutable, which can help maintain data integrity when dealing with large data sets or when multiple variables need to reference the same tuple."
91,How can someone sort a list by two criteria in python ?,"my_list = [('a', 5), ('b', 2), ('c', 7)]","We can sort a list by two criteria in Python using the sorted() function.  The sorted() function takes a key and a reverse argument as parameters. The key argument can be used to specify a function that will be used to extract a comparison key from each element in the list. The reverse argument, when set to True, will sort the list in descending order. 

For example:

my_list = [('a', 5), ('b', 2), ('c', 7)]
sorted_list = sorted(mylist, key=lambda score: score[1], reverse=True)

Where the sorted_list would be: [('c', 7), ('a', 5), ('b', 2)]"
92,How can someone count the unique elements in a list ?,"my_list = [2, 4, 6, 8, 2]","We can count the unique elements in a list using Python's built-in set() method. The set() method will take a list as an argument and return back a set of unique elements in the list. We can then count the number of unique elements by getting the length of the set. 

For example:

my_list = [2, 4, 6, 8, 2]
unique_elems = set(my_list)
number_of_unique_elems = len(unique_elems)

Where number_of_unique_elems would be: 4"
93,How can someone access a value at a given index in an array ?,"my_array = [2, 4, 6, 8, 10]","We can access a value at a given index in an array using the square bracket notation. The square bracket notation takes the index number as an argument and returns the value at that index. The indexing of Python arrays starts at 0. 

For example:

my_array = [2, 4, 6, 8, 10]
value_at_index_3 = my_array[3]

Where value_at_index_3 would be: 8"
